train,stations
train_1,"[Rotterdam Centraal, Zaandam, Hoorn, Heemstede-Aerdenhout, Schiedam Centrum, Haarlem]"
train_2,"[Zaandam, Amsterdam Centraal, Beverwijk, Amsterdam Sloterdijk, Amsterdam Amstel]"
train_3,"[Zaandam, Rotterdam Centraal, Hoorn, Castricum, Leiden Centraal, Dordrecht, Gouda, Alkmaar, Amsterdam Sloterdijk, Schiphol Airport, Alphen a/d Rijn]"
train_4,"[Alkmaar, Den Helder]"
train_5,"[Leiden Centraal, Schiedam Centrum, Gouda, Delft, Den Haag Centraal, Amsterdam Sloterdijk, Haarlem, Rotterdam Alexander]"
train_6,"[Rotterdam Centraal, Castricum, Beverwijk, Haarlem, Rotterdam Alexander]"
train_7,"[Zaandam, Castricum, Heemstede-Aerdenhout, Leiden Centraal, Gouda, Den Haag Centraal, Amsterdam Zuid, Amsterdam Amstel, Schiphol Airport, Alphen a/d Rijn, Amsterdam Sloterdijk]"
score,8919.0
